{
  "avoidance_constraints": [
    {
      "reason": "brief must_avoid",
      "term": "people"
    },
    {
      "reason": "brief must_avoid",
      "term": "text"
    },
    {
      "reason": "brief must_avoid",
      "term": "watermark"
    },
    {
      "reason": "brief must_avoid",
      "term": "logo"
    },
    {
      "reason": "empty chair is the concept; also brief must_avoid people",
      "term": "person sitting in the chair"
    },
    {
      "reason": "brief must_avoid people, including reflections",
      "term": "human silhouette or reflection in glass"
    },
    {
      "reason": "foam must not read as stone; loses the cheap-copy irony",
      "term": "marble"
    },
    {
      "reason": "common misread of white granular matter",
      "term": "snow"
    },
    {
      "reason": "chair must read as milled foam, not a finished product",
      "term": "glossy porcelain or white plastic chair"
    },
    {
      "reason": "metal belongs only to frame and tool head",
      "term": "chrome or polished metal on the foam"
    },
    {
      "reason": "dust must stay dry chips on the floor",
      "term": "fog, smoke or glowing dust particles"
    },
    {
      "reason": "sci-fi robot cliche",
      "term": "sparks, lasers, glowing LEDs"
    },
    {
      "reason": "sci-fi cliche; machine is an industrial tool head only",
      "term": "humanoid robot"
    },
    {
      "reason": "do not replicate the reference installation",
      "term": "central glass room enclosure"
    },
    {
      "reason": "do not replicate the reference installation",
      "term": "symmetrical rows of plinths"
    },
    {
      "reason": "reference work's subject; do not replicate",
      "term": "guardian lion statues"
    },
    {
      "reason": "reference work's camera position",
      "term": "frontal symmetrical wide gallery view"
    },
    {
      "reason": "keep the chair plain; avoid Quayola-like classical non finito",
      "term": "classical statue or ornate carving"
    },
    {
      "reason": "generic tech-ad aesthetic",
      "term": "teal-and-orange grading, lens flare, neon"
    },
    {
      "reason": "brief must_avoid logo",
      "term": "manufacturer livery on robot"
    }
  ],
  "brief_id": "brief_foam-vitrine-01",
  "composition": {
    "camera_angle": "low three-quarter view, just below seat height, clearly off axis (not frontal)",
    "focal_hierarchy": [
      "boundary where the finished chair leaves the raw block",
      "terraced roughing steps against the smooth ridged seat",
      "chair's single reflection and chip scatter on the dark floor",
      "out-of-focus robot tool head behind the glass panel at right edge"
    ],
    "framing": "medium",
    "layout": "chair and block on left third; long floor reflection below; cropped soft glass panel and tool head at right edge; dark space between",
    "lens_mm": 50,
    "negative_space": "generous"
  },
  "concept_id": "concept_seat-for-no-one",
  "concept_thesis": "A full-size chair half-released from a raw white foam block is milled to fit a human body it can never hold: it invites a sitter, but the soft foam would crush under one. Human identity survives only as the chair's ergonomics; authorship survives only as the toolpath. The image holds the pause mid-process, between offer and refusal.",
  "draft_id": "draft_foam-vitrine",
  "mood": [
    "quiet",
    "austere",
    "withheld invitation",
    "suspended mid-process",
    "documentary restraint"
  ],
  "notes_for_material_specialist": "The white foam is NOT a metal and must not be parameterised as one; its look (matte, dry, granular, beaded, no gloss, not marble, not snow) is carried entirely by subject.description, which leads the prompt. Only real metal belongs in materials. Make materials[0] the robot tool head: the spindle housing and ball-end mill, brushed steel with low reflectivity and a dust-coated, powder-dulled finish (imperfections such as white powder film and clinging foam beads), role 'machine presence, secondary, out of focus at right edge'. This is the element most at risk of disappearing, and without it the chair reads as hand-carved. materials[1] should be the slim black steel frame of the glass panel: matte blackened or oxidized steel, low reflectivity, flat curvature, faint dust film. Do not use liquid or polished chrome anywhere; nothing mirror-like should compete with the foam, and no metal terms should transfer onto the chair. Lighting suggestions (your call): a single raking side key from the left, medium-soft, neutral to slightly warm gallery tone, low or no fill, high contrast in a dark gallery so the foam is the only light-bearing substance; it should graze the terraced steps to reveal them without creating specular glints on the foam. The environment is a dark empty gallery, with no windows or bright reflections that could resolve into figures.",
  "output": {
    "aspect_ratio": "16:9",
    "height": 576,
    "width": 1024
  },
  "palette": {
    "colors": [
      {
        "hex": "#121315",
        "name": "gallery black",
        "role": "dominant"
      },
      {
        "hex": "#E6E4DF",
        "name": "matte foam white",
        "role": "secondary"
      },
      {
        "hex": "#3A3C40",
        "name": "graphite steel",
        "role": "accent"
      },
      {
        "hex": "#050506",
        "name": "deep black",
        "role": "shadow"
      },
      {
        "hex": "#F3F2EE",
        "name": "chalk highlight",
        "role": "highlight"
      }
    ],
    "saturation": "monochrome"
  },
  "produced_by": {
    "kind": "agent",
    "name": "art-director"
  },
  "schema_version": "atelier.art_direction_draft.v1",
  "semantic_constraints": [
    {
      "constraint": "no people anywhere: no seated figure, body parts, silhouettes or reflections",
      "priority": "must"
    },
    {
      "constraint": "no text, wall labels, watermark or logo; robot arm unbranded",
      "priority": "must"
    },
    {
      "constraint": "chair visibly emerges from a raw rectangular block; backrest still fused to the uncut block",
      "priority": "must"
    },
    {
      "constraint": "foam reads matte, dry and granular, with no specular highlights",
      "priority": "must"
    },
    {
      "constraint": "dark polished gallery floor carrying one clean reflection of the chair",
      "priority": "must"
    },
    {
      "constraint": "the chair is empty",
      "priority": "must"
    },
    {
      "constraint": "coarse terraced roughing steps on the uncut block, fine ridges on the finished seat",
      "priority": "should"
    },
    {
      "constraint": "robot tool head present but cropped and out of focus at the right edge, behind one glass panel",
      "priority": "should"
    },
    {
      "constraint": "thin scatter of white chips and beads around the base, not a dune or fog",
      "priority": "should"
    },
    {
      "constraint": "chair placed on the left third, viewed from a low asymmetric three-quarter angle",
      "priority": "should"
    }
  ],
  "subject": {
    "description": "half-carved plain chair emerging from raw matte white foam block on dark reflective gallery floor. The seat and front legs are finished with fine toolpath ridges; the backrest is still fused into the uncut rectangular block, which shows coarse terraced roughing steps. Dry, granular, beaded foam surfaces with no gloss. A thin scatter of white chips and beads on the floor around the base. At the right frame edge, cropped and out of focus, a black-framed glass panel with a faint powder film and a dust-coated white robot tool head behind it. The chair is empty.",
    "human_presence": "implied",
    "human_treatment": "only through the chair's human scale and seat shape; no person, body part, silhouette or reflection anywhere"
  },
  "visual_hypothesis": "If one plain, archetypal four-legged chair visibly emerges from a matte white foam block (finished seat and front legs, backrest still fused into a rough rectangular block cut in coarse terraced steps), standing directly on a dark polished gallery floor with no plinth, shot from a low asymmetric three-quarter angle with the chair on the left third, then a small model will read 'carved from a block' from the block-to-chair transition, and will read foam rather than marble from the terraced steps and dry granular faces. A thin scatter of white chips around the base implies the process; one cropped, out-of-focus black-framed glass panel with a dust-coated robot tool head behind it at the right edge keeps the machine present but secondary. The dark floor gives the chair one long, clean reflection with nothing else in it."
}
